Handle,Title,Body (HTML),Vendor,Type,Tags,Published,Option1 Name,Option1 Value,Variant SKU,Variant Grams,Variant Inventory Tracker,Variant Inventory Qty,Variant Inventory Policy,Variant Fulfillment Service,Variant Price,Variant Compare At Price,Variant Requires Shipping,Variant Taxable,Image Src,Image Position,Image Alt Text,Status
"premium-japanese-sneakers","Premium Japanese Sneakers","High-quality sneakers from Japan with excellent comfort and style. Sneakers Nhật Bản cao cấp, êm ái và thời trang.","WRLDS JAPAN","Shoes","shoes, japanese, premium, sneakers","TRUE","Title","Default Title","SHOES-001","500","shopify","15","deny","manual","100.00","120.00","TRUE","TRUE","/lovable-uploads/078a129e-0f98-4d91-af61-873687db1a04.png","1","Premium Japanese Sneakers - Primary Image","active"
"korean-beauty-set","Korean Beauty Set","Complete Korean skincare set for glowing skin. Bộ skincare Hàn Quốc đầy đủ cho làn da rạng rỡ.","WRLDS KOREA","Beauty","beauty, korean, skincare","TRUE","Title","Default Title","BEAUTY-001","500","shopify","25","deny","manual","72.00","80.00","TRUE","TRUE","/lovable-uploads/11e92b89-ed02-453a-9888-56cd91807f2d.png","1","Korean Beauty Set - Primary Image","active"
"american-tech-gadget","American Tech Gadget","Latest technology gadget from the USA with premium features. Thiết bị công nghệ từ Mỹ với tính năng cao cấp.","WRLDS USA","Electronics","electronics, tech, gadget, usa","TRUE","Title","Default Title","TECH-001","500","shopify","8","deny","manual","140.00","160.00","TRUE","TRUE","/lovable-uploads/14ea3fe0-19d6-425c-b95b-4117bc41f3ca.png","1","American Tech Gadget - Primary Image","active"
"european-fashion-watch","European Fashion Watch","Elegant European watch with sophisticated design. Đồng hồ thời trang châu Âu thiết kế tinh xảo.","WRLDS EUROPE","Fashion","fashion, watch, luxury, europe","TRUE","Title","Default Title","WATCH-001","500","shopify","12","deny","manual","208.00","240.00","TRUE","TRUE","/lovable-uploads/1cd5a3da-7a58-4374-abc1-d7b02b0c5fd5.png","1","European Fashion Watch - Primary Image","active"
"japanese-gaming-console","Japanese Gaming Console","Latest gaming console from Japan with exclusive games. Máy chơi game Nhật Bản với hệ game độc quyền.","WRLDS JAPAN","Gaming","gaming, console, japanese, preorder","TRUE","Title","Default Title","GAME-001","500","shopify","5","deny","manual","340.00","360.00","TRUE","TRUE","/lovable-uploads/30473baa-85f4-4931-aad9-c722ae7a4918.png","1","Japanese Gaming Console - Primary Image","active"
"korean-home-appliance","Korean Home Appliance","Smart home appliance with advanced Korean technology. Thiết bị gia dụng thông minh công nghệ Hàn Quốc.","WRLDS KOREA","Home & Living","home, appliance, smart, korean","TRUE","Title","Default Title","HOME-001","500","shopify","18","deny","manual","168.00","192.00","TRUE","TRUE","/lovable-uploads/39605e90-8478-4fee-b1b9-cee41df66f10.png","1","Korean Home Appliance - Primary Image","active"
"usa-premium-headphones","USA Premium Headphones","High-quality headphones with premium sound from USA. Tai nghe cao cấp từ Mỹ, âm thanh trung thực.","WRLDS USA","Audio","audio, headphones, premium, usa","TRUE","Title","Default Title","AUDIO-001","500","shopify","0","deny","manual","128.00","144.00","TRUE","TRUE","/lovable-uploads/39671993-1bb4-4bb6-8819-3ca5c07c0042.png","1","USA Premium Headphones - Primary Image","draft"
"european-luxury-bag","European Luxury Bag","Designer luxury bag from Europe with premium materials. Túi xách cao cấp châu Âu, chất liệu thượng hạng.","WRLDS EUROPE","Accessories","accessories, bag, luxury, designer","TRUE","Title","Default Title","BAG-001","500","shopify","7","deny","manual","272.00","300.00","TRUE","TRUE","/lovable-uploads/3de85ddd-15e1-4216-9697-f91abb9a47ce.png","1","European Luxury Bag - Primary Image","active"